Publications,Descriptions
2017,"P. Velez, L. Su, J. Mata-Contreras, F. Martin, K. Grenier, D. Dubuc, ""Modeling and analysis of pairs of open complementary split ring resonators (OCSRRs) for differential permittivity sensing"", IEEE MTT-S International Microwave Workshop Series on Advanced Materials and Processes for RF and THz Applications, IMWS-AMP 2017, 2018-January, 1-3. https://doi.org/10.1109/IMWS-AMP.2017.8247338"
2017,"C. Herrojo, J. Mata-Contreras, F. Paredes, F. Martin, ""Near-field chipless RFID encoders with sequential bit reading and high data capacity"", IEEE MTT-S International Microwave Symposium Digest, 1564-1567. https://doi.org/10.1109/MWSYM.2017.8058928"
2016,"E. Abdo-Sanchez, D. Palacios, C. Frias, F.Y. Ng-Molina, T.M. Martin-Guerrero, C. Camacho-Peñalosa, ""Design aspects of a broadband beam-reconfigurable leaky-wave antenna"", IEEE Antennas and Propagation Society International Symposium, APSURSI 2016 - Proceedings, 643-644. https://doi.org/10.1109/APS.2016.7696030"
2016,"L. Su, J. Naqui, J. Mata-Contreras, F. Martin, ""Cascaded splitter/combiner microstrip sections loaded with complementary split ring resonators (CSRRs): Modeling, analysis and applications"", IEEE MTT-S International Microwave Symposium Digest, 2016-August. https://doi.org/10.1109/MWSYM.2016.7539956"
2015,"E. Abdo-Sanchez, T.M. Martin-Guerrero, J. Esteban, C. Camacho-Peñalosa, ""A Self-Diplexing Dual-Band Planar Array for GNSS Applications"", 2015 IEEE INTERNATIONAL SYMPOSIUM ON ANTENNAS AND PROPAGATION & USNC/URSI NATIONAL RADIO SCIENCE MEETING, 1874-1875"
2015,"E. Abdo-Sanchez, T.M. Martin-Guerrero, J. Esteban, C. Camacho-Peñalosa, "" A self-diplexing dual-band planar array for GNSS applications"", IEEE Antennas and Propagation Society, AP-S International Symposium (Digest), 2015-October, 1874-1875. https://doi.org/10.1109/APS.2015.7305326"
2015,"E. Abdo-Sanchez, T.M. Martin-Guerrero, J. Esteban, C. Camacho-Peñalosa, ""On the phase response and radiation efficiency of the complementary strip-slot as an array element"", 9th European Conference on Antennas and Propagation, EuCAP 2015"
2015,"A. Raffo, P. Colantonio, E. Cipriani, V. Vadala, G. Bosi, T.M. Martin-Guerrero, G. Vannini, G. F. Giannini, ""Theoretical consideration on harmonic manipulated amplifiers based on experimental data"", International Workshop on Integrated Nonlinear Microwave and Millimetre-wave Circuits, INMMiC 2015. https://doi.org/10.1109/INMMIC.2015.7330351"
2015,"L. Su, J. Naqui, J. Mata-Contreras, F. Martin, ""Analysis of coupled micro strip lines loaded with complementary split ring resonators (CSRRs) and applications"", Asia-Pacific Microwave Conference Proceedings, APMC, 1. https://doi.org/10.1109/APMC.2015.7411640"
2015,"Velez, Valero, Su, Naqui, Mata-Contreras, Bonache, & Martin, ""Differential microstrip lines with wideband common-mode rejection based on chirped-EBGs"", Proceedings of the 2015 International Conference on Electromagnetics in Advanced Applications, ICEAA 2015, 855-858. https://doi.org/10.1109/ICEAA.2015.7297234"
2015,"L. Su, J. Naqui, J. Mata-Contreras, F. Martin, ""Dual-band epsilon-negative (ENG) transmission line metamaterials based on microstrip lines loaded with pairs of coupled complementary split ring resonators (CSRRs): Modeling, analysis and applications"", 9th International Congress on Advanced Electromagnetic Materials in Microwaves and Optics, METAMATERIALS 2015, 298-300. https://doi.org/10.1109/METAMATERIALS.2015.7342428"
2015,"L. Su, J. Naqui, J. Mata-Contreras, P. Velez, F. Martin, ""Transmission line metamaterials based on pairs of coupled split ring resonators (SRRs) and complementary split ring resonators (CSRR): A comparison to the light of the lumped element equivalent circuits"", Proceedings of the 2015 International Conference on Electromagnetics in Advanced Applications, ICEAA 2015, 891-894. https://doi.org/10.1109/ICEAA.2015.7297242"
